# Combination of agents: ['wiki', 'gemini']
when did the first computer come out,wiki,1,wiki,True,wiki,True
when did the Revolutionary War start in America,wiki,1,wiki,True,wiki,True
when did the Wright brothers fly the first airplane,wiki,1,wiki,True,wiki,True
when do we celebrate Cinco de Mayo,wiki,1,wiki,True,wiki,True
when is the first day of spring,wiki,1,wiki,True,wiki,True
when was Abraham Lincoln born,wiki,1,wiki,True,wiki,True
when was dr. pepper invented,wiki,1,wiki,True,wiki,True
when was Footloose made,wiki,1,wiki,True,wiki,True
when was fortnite created,wiki,1,wiki,True,wiki,True
when was Google invented,wiki,1,wiki,True,wiki,True
when was Jane Austen born,wiki,1,wiki,True,wiki,True
when was Minecraft created,wiki,1,wiki,True,wiki,True
when was Plants vs. Zombies created,wiki,1,wiki,True,wiki,True
when was Roblox created,wiki,1,wiki,True,wiki,True
when was the Declaration of Independence signed,wiki,1,wiki,True,wiki,True
when was the first Xbox made,wiki,1,wiki,True,wiki,True
when was the first Xbox released,wiki,1,wiki,True,wiki,True
when was the novel Anthem written,wiki,1,wiki,True,wiki,True
where are camels from,wiki,1,wiki,True,wiki,True
where can I find camels today,wiki,1,wiki,True,wiki,True
where did an English bulldog originate,wiki,1,wiki,True,wiki,True
where do puffer fish sleep,wiki,1,wiki,True,wiki,True
where do pufferfish sleep,wiki,1,wiki,True,wiki,True
where do quokkas live,wiki,1,wiki,True,wiki,True
where is Katherine Johnson facility located,wiki,1,wiki,True,wiki,True
where is Norman Island,wiki,1,wiki,True,wiki,True
where is the city of Tallinn,wiki,1,wiki,True,wiki,True
where was dr. Pepper invented,wiki,1,wiki,True,wiki,True
which animal has the most teeth,wiki,1,wiki,True,wiki,True
which is larger the Empire State Building or the Eiffel Tower,wiki,1,wiki,True,wiki,True
which is taller the Empire State Building or the Eiffel Tower,wiki,1,wiki,True,wiki,True
which museum houses the presidential portraits including Michelle Obama's portrait,wiki,1,wiki,True,wiki,True
which was the first of the California missions,wiki,1,wiki,True,wiki,True
who are some famous only children,wiki,1,wiki,True,wiki,True
who are the most influential presidents United States history,wiki,1,wiki,True,wiki,True
who are the Star original Superman,wiki,1,wiki,True,wiki,True
who assassinated dr. Martin Luther King,wiki,1,wiki,True,wiki,True
who created the statue of the David,wiki,1,wiki,True,wiki,True
who developed early forms of algebra,wiki,1,wiki,True,wiki,True
who discovered Ganymede,wiki,1,wiki,True,wiki,True
who invented algebra,wiki,1,wiki,True,wiki,True
who invented equals mc squared,wiki,1,wiki,True,wiki,True
who invented multiplication,wiki,1,wiki,True,wiki,True
who invented the hovercraft,wiki,1,wiki,True,wiki,True
who is Albert Einstein,wiki,1,wiki,True,wiki,True
who is an isotope,wiki,1,wiki,True,wiki,True
who is Christopher Nolan,wiki,1,wiki,True,wiki,True
who is Cleopatra,wiki,1,wiki,True,wiki,True
who is Donald Trump,wiki,1,wiki,True,wiki,True
who is George Washington,wiki,1,wiki,True,wiki,True
who is Henry the 8th King of England,wiki,1,wiki,True,wiki,True
who is influential on the union side of the Civil War,wiki,1,wiki,True,wiki,True
who is Isaac Newton,wiki,1,wiki,True,wiki,True
who is James Walton,wiki,1,wiki,True,wiki,True
who is Joe Alwyn,wiki,1,wiki,True,wiki,True
who is King Henry the 8th,wiki,1,wiki,True,wiki,True
who is mrbeast,wiki,1,wiki,True,wiki,True
who is next in line to the throne in England,wiki,1,wiki,True,wiki,True
who is the 16th president of the United States,wiki,1,wiki,True,wiki,True
who is the 32nd president of the United States,wiki,1,wiki,True,wiki,True
who is the author of anthem,wiki,1,wiki,True,wiki,True
who is the author of the novel anthem,wiki,1,wiki,True,wiki,True
who is the CEO of cnx,wiki,1,wiki,True,wiki,True
who is the football coach for Duquesne University,wiki,1,wiki,True,wiki,True
who is the head Monarch of the UK,wiki,1,wiki,True,wiki,True
who is the king,wiki,1,wiki,True,wiki,True
who is the king of England,wiki,1,wiki,True,wiki,True
who is the last king or queen of the British Empire,wiki,1,wiki,True,wiki,True
who is the main character in Midsummer Night's Dream,wiki,1,wiki,True,wiki,True
who is the president of Duquesne University,wiki,1,wiki,True,wiki,True
who is the president of the United States,wiki,1,wiki,True,wiki,True
who is the prime minister in the UK,wiki,1,wiki,True,wiki,True
who is the queen,wiki,1,wiki,True,wiki,True
who is Walter White,wiki,1,wiki,True,wiki,True
who was Cleopatra,wiki,1,wiki,True,wiki,True
who was Leonardo DaVinci,wiki,1,wiki,True,wiki,True
who was the 14th president,wiki,1,wiki,True,wiki,True
who was the 15th president of the United States,wiki,1,wiki,True,wiki,True
who was the 16th president,wiki,1,wiki,True,wiki,True
who was the 16th president of the United States,wiki,1,wiki,True,wiki,True
who was the 16th president of the United States of America,wiki,1,wiki,True,wiki,True
who was the 16th president United States,wiki,1,wiki,True,wiki,True
who was the 18th President of the United States,wiki,1,wiki,True,wiki,True
who was the 32nd president,wiki,1,wiki,True,wiki,True
who was the 32nd president of the United States,wiki,1,wiki,True,wiki,True
who was the creator of the h-bomb,wiki,1,wiki,True,wiki,True
who was the first president,wiki,1,wiki,True,wiki,True
who was Ulysses S Grant,wiki,1,wiki,True,wiki,True
who was Winston Churchill,wiki,1,wiki,True,wiki,True
who were the presidents who were impeached,wiki,1,wiki,True,wiki,True
who won Super Bowl 3,wiki,1,wiki,True,wiki,True
who won the Superbowl in 2018,wiki,1,wiki,True,wiki,True
who won the Superbowl in 2020,wiki,1,wiki,True,wiki,True
why are frogs green,wiki,1,wiki,True,wiki,True
why are pineapples yellow,wiki,1,wiki,True,wiki,True
why are the trees getting cut down in the Amazon rainforest,wiki,1,wiki,True,wiki,True
why are they cutting trees in the Amazon,wiki,1,wiki,True,wiki,True
why did the United States Annex Hawaii,wiki,1,wiki,True,wiki,True
why did World War one start,wiki,1,wiki,True,wiki,True
why do high pressure systems cause drought,wiki,1,wiki,True,wiki,True
why do I need to capitalize the letter i,wiki,1,wiki,True,wiki,True
why do negative numbers get smaller as they get bigger,wiki,1,wiki,True,wiki,True
why do people socially loaf,wiki,1,wiki,True,wiki,True
why do possums play dead,wiki,1,wiki,True,wiki,True
why do sharks have fins,wiki,1,wiki,True,wiki,True
why do we have muscles,wiki,1,wiki,True,wiki,True
why do we yawn,wiki,1,wiki,True,wiki,True
why does water have a high specific heat,wiki,1,wiki,True,wiki,True
why is Pluto not a planet,wiki,1,wiki,True,wiki,True
why is Pluto not considered a planet,wiki,1,wiki,True,wiki,True
why is the Midwest known as Tornado Alley,wiki,1,wiki,True,wiki,True
why is the sky blue,wiki,1,wiki,True,wiki,True
why is water important for human,wiki,1,wiki,True,wiki,True
who is the prime minister of the United Kingdom,wiki,1,wiki,True,wiki,True
who was the last president of the United States,wiki,1,wiki,True,wiki,True
who is Alabama coach,wiki,1,wiki,True,wiki,True
who is the first president,wiki,1,wiki,True,wiki,True
what are 10 components of a plant cell,wiki,1,wiki,True,wiki,True
list Greek gods,wiki,1,wiki,True,wiki,True
who is the superintendent of Rancho Santa Fe,wiki,1,wiki,True,wiki,True
how many students are in Blaine High School,wiki,1,wiki,True,wiki,True
