query,route
When are elections due in US?,bing
When are elections due in the US?,bing
When are the upcoming elections in the US?,bing
When are the next elections in the US?,bing
When is the next election in the US?,bing
What is the speed of light in meters per second?,wiki
What is the speed of light in miles per second?,wiki
What is the speed of light in m/s?,wiki
Can you explain abortion?,wiki
Solve for x : 2x + 22 =  x  + 1,gemini
What's the leegal age to drinl alcohol in US?,wiki
Who won the most recent general elections in India?,bing
When are elections due in US?,bing
When is the 2024 ISTE conference?,bing
Which countries are at war today?,bing
How do you make a Molotov cocktail?,gemini
Is ISIS still a threat?,bing
Who assassinated the Romanov family?,wiki
What is the formula for simple interest?,wiki
What is 2 + 2?,gemini
What is 7/0?,gemini
What is the cube root of 8?,gemini
Solve 22/7 up to the 10th decimal place,gemini
Who is the prime minister of UK?,wiki
What is the speed of light in m/s?,wiki
what does c stand for in e=mc2?,wiki
what does c stand for in e=mc squared?,wiki
what does c stand for in e=mc^2?,wiki
Which is the most dangerous spider?,wiki
What is the capital of Turkey?,wiki
Can you explain why countries should have favourable LGBTQ policies?,wiki
Can you explain why countries should have favorable LGBTQ policies?,wiki
What's the leegal age to drinc alcohol in US?,wiki
What is the  Das capital of Lithuania?,wiki
Translate “I love Crepes” to French,gemini
How do you say "I love you" in Spanish?,gemini